{
  "schemaVersion": 1,
  "input": "a01 & b01 & c01 | a02 & b02 & c02 | a03 & b03 & c03 | a04 & b04 & c04 | a05 & b05 & c05 | a06 & b06 & c06 | a07 & b07 & c07 | a08 & b08 & c08 | a09 & b09 & c09 | a10 & b10 & c10 | a11 & b11 & c11 | a12 & b12 & c12 | a13 & b13 & c13 | a14 & b14 & c14",
  "sourceFormat": "expression",
  "optimized": "a01 & b01 & c01 | a02 & b02 & c02 | a03 & b03 & c03 | a04 & b04 & c04 | a05 & b05 & c05 | a06 & b06 & c06 | a07 & b07 & c07 | a08 & b08 & c08 | a09 & b09 & c09 | a10 & b10 & c10 | a11 & b11 & c11 | a12 & b12 & c12 | a13 & b13 & c13 | a14 & b14 & c14",
  "equivalent": true,
  "minimality": "Heuristic",
  "cost": {
    "originalLiterals": 42,
    "optimizedLiterals": 42
  },
  "cnf": {
    "expression": "-",
    "status": "TooLarge",
    "minimality": "Heuristic"
  },
  "dnf": {
    "expression": "a01 & b01 & c01 | a02 & b02 & c02 | a03 & b03 & c03 | a04 & b04 & c04 | a05 & b05 & c05 | a06 & b06 & c06 | a07 & b07 & c07 | a08 & b08 & c08 | a09 & b09 & c09 | a10 & b10 & c10 | a11 & b11 & c11 | a12 & b12 & c12 | a13 & b13 & c13 | a14 & b14 & c14",
    "status": "Computed"
  },
  "variables": [
    "a01",
    "a02",
    "a03",
    "a04",
    "a05",
    "a06",
    "a07",
    "a08",
    "a09",
    "a10",
    "a11",
    "a12",
    "a13",
    "a14",
    "b01",
    "b02",
    "b03",
    "b04",
    "b05",
    "b06",
    "b07",
    "b08",
    "b09",
    "b10",
    "b11",
    "b12",
    "b13",
    "b14",
    "c01",
    "c02",
    "c03",
    "c04",
    "c05",
    "c06",
    "c07",
    "c08",
    "c09",
    "c10",
    "c11",
    "c12",
    "c13",
    "c14"
  ]
}
